meta,meta,meta,,,incident,incident,incident,incident,incident,incident,incident,resp_party,resp_party,resp_party,resp_party,resp_party,resp_party,resp_party,harm,,harm,,harm,harm,harm,harm,harm,harm,,harm,,harm,harm,harm,harm,harm,harm,harm,harm,harm,harm,harm,harm,harm,harm,,harm,harm,harm,harm,harm,harm,harm,harm,harm,harm,harm,harm,harm,harm,harm,harm,,harm,harm,ai,ai,ai,ai,ai,ai,ai,,ai,ai,ai,,,ai,ai,,ai,ai,ai,ai,ai,ai,ai,,ai,ai,ai,ai,,notes
no,annotator,status,,,desc_full,desc_short,begin,end,location,near_miss,named_entities,1.name,1.type,2.name,2.type,3.name,3.type,intent,severe,,type.health,,type.finance,type.prop,type.intangible,type.socio,type.lib,type.other,,lives,,equity.race,equity.religion,equity.national,equity.geo,equity.age,equity.sex,equity.gender,equity.family,equity.disability,equity.vet,equity.genetic,equity.financial,equity.ideo,equity.other,,sector.chem,sector.commercial,sector.comms,sector.manufacturing,sector.dams,sector.dib,sector.ems,sector.energy,sector.finance,sector.food,sector.gov,sector.health,sector.it,sector.nuclear,sector.transport,sector.water,,financial,laws,desc,data,developer,sector,publicsector,enduser,autonomy,,functions.perception,functions.cognition,functions.action,,,techniques,tools,,system.consumer,system.industrial,system.weapons,system.mobile,system.software,system.unknown,system.other,,problem.specification,problem.robustness,problem.assurance,problem.unclear,,notes
1.1,1.2,1.3,1.4,1.5,2.1,2.2,2.3,2.4,2.5,2.6,2.7,3.1,,,,,,3.2,4.1,,4.2,,,,,,,,,4.3,,4.4,,,,,,,,,,,,,,,4.5,,,,,,,,,,,,,,,,,4.6,4.7,5.1,5.2,5.3,5.4,5.5,5.6,5.7,,5.8,,,,,5.9,5.10,,5.11,,,,,,,,5.12,,,,,6.1
Incident number,Who is responsible for this row?,What is the status of this row?,Peer reviewer,Selected for quality control?,Description (full),Description (short),Date (beginning),Date (end),Location,Near miss?,Named entities,Who was responsible for the relevant tool or system?,,,,,,Probable level of intent,Overall severity of harm,,What type of harm was caused?,,,,,,,,,Were human lives lost?,,"If harms were unevenly distributed among people, on what basis?",,,,,,,,,,,,,,,"Which critical infrastructure sectors were affected, if any?",,,,,,,,,,,,,,,,,Total financial cost,Laws implicated,Description of the AI system(s) involved,Description of the data inputs to the AI system(s),System developer,Sector of deployment,Public sector deployment,Nature of end user,Level of autonomy,,Relevant AI functions,,,,,AI tools and techniques used,AI functions and applications used,,"Into what type of physical system was the AI integrated, if any?",,,,,,,,What was the nature of the problem(s) with the AI that led to the accident?,,,,,Notes
,,,,,,,,,,,,Party 1 (name),Party 1 (type),Party 2 (name),Party 2 (type),Party 3 (name),Party 3 (type),,,,Harm to physical health/safety,Psychological harm,Financial harm,Harm to physical property,Harm to intangible property,Harm to social or political systems,Harm to civil liberties,Other (specify),,,,Race,Religion,National origin or immigrant status,Geography,Age,Sex,Sexual orientation or gender identity,Familial status or pregnancy,Disability,Veteran status,Genetic information,Financial means,Ideology,Other (specify),,Chemical,Commercial facilities,Communications,Critical manufacturing,Dams,Defense-industrial base,Emergency services,Energy,Financial services,Food and agriculture,Government facilities,Healthcare and public health,Information technology,Nuclear,Transportation,Water and wastewater,,,,,,,,,,,,Perception,Cognition,Action,Unclear,,,,,Consumer device,Industrial process system,Weapons system,Vehicle/mobile robot,Software only,Unknown/unclear,Other (specify),,Specification,Robustness,Assurance,Unknown/unclear,,
1,Zach Arnold,6. Complete and final,Devon Colmer,,"The content filtering system for YouTube's children's entertainment app, which incorporated algorithmic filters and human reviewers, failed to screen out inappropriate material, exposing an unknown number of children to videos that included sex, drugs, violence, profanity, and conspiracy theories. Many of the videos, which apparently numbered in the thousands, closely resembled popular children's cartoons such as Peppa Pig, but included disturbing or age-inappropriate content. Additional filters provided by YouTube, such as a ""restricted mode"" filter, failed to block all of these videos, and YouTube's recommendation algorithm recommended them to child viewers, increasing the harm. The problem was reported as early as 2015 and was ongoing through 2018.",YouTube’s content filtering and recommendation algorithms exposed children to disturbing and inappropriate videos.,2015,2018,"Global, apparently",Unclear/unknown,Google; YouTube; YouTube Kids,YouTube,For-profit business,Google,For-profit business,,,Accident,Moderate,,FALSE,TRUE,FALSE,FALSE,FALSE,FALSE,FALSE,,,No,,FALSE,FALSE,FALSE,FALSE,TRUE,FALSE,FALSE,FALSE,FALSE,FALSE,FALSE,FALSE,FALSE,,,FALSE,FALSE,FALSE,FALSE,FALSE,FALSE,FALSE,FALSE,FALSE,FALSE,FALSE,FALSE,FALSE,FALSE,FALSE,FALSE,,,,"A content filtering system incorporating machine learning algorithms and human reviewers. The system was meant to screen out videos that were unsuitable for children to view or that violated YouTube's terms of service. These videos were initially collected either algorithmically or on the basis of user reports.

A recommendation system that suggested videos to viewers based on their viewing history on the platform.",Videos; video metadata; complaints submitted by users,YouTube,"Arts, entertainment and recreation",No,,,,TRUE,TRUE,TRUE,FALSE,,machine learning,content filtering; decision support; curation; recommendation engine,,FALSE,FALSE,FALSE,FALSE,TRUE,FALSE,,,FALSE,FALSE,FALSE,TRUE,,
2,Zach Arnold,6. Complete and final,Devon Colmer,,"On December 5, 2018, a robot punctured a can of bear spray in Amazon's fulfillment center in Robbinsville, New Jersey. Amazon's spokesman stated that ""an automated machine punctured a 9-oz can of bear repellent."" The punctured can released capsaicin, an irritant, into the air. Several dozen workers were exposed to the fumes, causing symptoms including trouble breathing and a burning sensation in the eyes and throat. 24 workers were hospitalized, and one was sent to intensive care and intubated.",Twenty-four Amazon workers in New Jersey were hospitalized after a robot punctured a can of bear repellent spray in a warehouse.,12/05/2018,12/05/2018,"Robbinsville, NJ",Harm caused,Amazon,Amazon,For-profit business,,,,,Accident,Moderate,,TRUE,FALSE,FALSE,TRUE,FALSE,FALSE,FALSE,,,No,,FALSE,FALSE,FALSE,FALSE,FALSE,FALSE,FALSE,FALSE,FALSE,FALSE,FALSE,FALSE,FALSE,,,FALSE,FALSE,FALSE,FALSE,FALSE,FALSE,FALSE,FALSE,FALSE,FALSE,FALSE,FALSE,FALSE,FALSE,FALSE,FALSE,,,Workplace safety laws; OSHA regulations,An automated machine operating within an Amazon fulfillment center.,,,Transportation and storage,No,,Unclear/unknown,,FALSE,FALSE,FALSE,TRUE,,,robotics,,FALSE,FALSE,FALSE,FALSE,FALSE,TRUE,,,FALSE,FALSE,FALSE,TRUE,,
3,Zach Arnold,3. In peer review,Dahlia/Charlie,,"A Boeing 737 MAX aircraft equipped with a new, automated flight control system plunged into the Java Sea, killing 189 people on board. On October 29, 2018, shortly after takeoff from Jakarta, Lion Air Flight 610 reported a malfunction in its ""angle of attack"" sensor. Based on faulty readings from the single sensor, the plane's Maneuvering Characteristics Augmentation System (MCAS) forced the plane's nose down in order to prevent stalling. The pilots pulled the nose back up over twenty times, but the MCAS system counteracted their actions. Eventually, the plane hit the ocean at a speed of several hundred miles per hour. Flight 610 had experienced a similar problem on a previous flight, but in that case, the pilots were able to override MCAS using an emergency procedure. Commentators speculated that the pilots on the day of the fatal crash may have been confused or startled, and that they may not have been fully aware of the MCAS system and how they could override it.","A Boeing 737 crashed into the sea, killing 189 people, after faulty sensor data caused an automated manuevering system to repeatedly push the plane's nose downward.",10/29/2018,10/29/2018,"Java Sea, off the coast of Jakarta",Harm caused,Lion Air; Boeing,Lion Air,For-profit business,,,,,Accident,Critical,,TRUE,TRUE,FALSE,TRUE,TRUE,FALSE,FALSE,,,Yes,,FALSE,FALSE,FALSE,FALSE,FALSE,FALSE,FALSE,FALSE,FALSE,FALSE,FALSE,FALSE,FALSE,,,FALSE,FALSE,FALSE,FALSE,FALSE,FALSE,FALSE,FALSE,FALSE,FALSE,FALSE,FALSE,FALSE,FALSE,TRUE,FALSE,,,Federal Aviation Administration regulations; Indonesian air safety regulations,"MCAS (Maneuvering Characteristics Augmentation System), an aircraft maneuvering system that can autonomously steer the plane based on sensor input",Aircraft sensor data,Boeing,Transportation and storage,No,Expert,High,,TRUE,TRUE,TRUE,FALSE,,,Aircraft maneuvering; sensor input processing,,FALSE,FALSE,FALSE,TRUE,FALSE,FALSE,,,FALSE,TRUE,TRUE,FALSE,,
7,Thomas Giallella,4. Peer review complete,Thomas Giallella,,"Wikipedia bots meant to help edit articles through artificial intelligence clash with each other, undoing the other's edits repetitively. The bots are meant to remove vandalism on the open-source, open-input site, however they have begun to disagree with each other and form infintie feedback loops of correcting the other's edits. Two notable cases are the face off between Xqbot and Darnkessbot that has led to 3,629 edited articles between 2009-2010 and between Tachikoma and Russbot leading to more than 3,000 edits. These edits have occurred across articles in 13 languages on Wikipedia, with the most ocurring in Portuguese language articles and the least occurring in German language articles. The whole situation has been described as a ""bot-on-bot editing war.""",Wikipedia bots meant to remove vandalism clash with each other and form feedback loops of repetitve undoing of the other bot's edits. ,2001,2010,Wikipedia platform,Unclear/unknown,Wikipedia,Wikipedia,Other type of organization,,,,,Accident,Negligible,,FALSE,FALSE,FALSE,FALSE,FALSE,FALSE,FALSE,Harm to publicly available information,,No,,FALSE,FALSE,FALSE,FALSE,FALSE,FALSE,FALSE,FALSE,FALSE,FALSE,FALSE,FALSE,FALSE,,,FALSE,FALSE,FALSE,FALSE,FALSE,FALSE,FALSE,FALSE,FALSE,FALSE,FALSE,FALSE,FALSE,FALSE,FALSE,FALSE,,,,Wikipedia editing bots meant to remove vandalism on the site,Wikipedia articles; edits from other bots,Wikipedia,Information and communication,No,Amateur,High,,TRUE,TRUE,TRUE,FALSE,,Content editing bot,AI content creation; AI content editing,,FALSE,FALSE,FALSE,FALSE,TRUE,FALSE,,,TRUE,TRUE,TRUE,FALSE,,Unclear if this meets definition of harm.
67,Srishti Khemka,4. Peer review complete,Thomas Giallella,,"A Tesla Model S continued autopilot at 70 mph on a California highway in November 2018 despite the driver's hands not being placed on the wheel, a requirement of enabling the Autopilot system. The California Highway Patrol was unable to wake the driver and had to drive in front of the Tesla for approximately 7 minutes to activate its 'driver assist' feature and slow the vehicle to a stop. The driver was allegedly sleeping and with his blood alcohol content being twice the legal limit.","A Tesla Model S remained on autopilot while being operated by a drunk, sleeping operator whose hands were not on the wheel. The police had to slow the car down by slowing in front of the vehicle to activate its 'driver assist' feature .",11/30/2018,11/30/2018,"Palo Alto, CA",Near miss,Teslal; Model S; California; California Highway Patrol,Tesla,For-profit business,,,,,Accident,Negligible,,TRUE,FALSE,FALSE,FALSE,FALSE,FALSE,FALSE,,,No,,FALSE,FALSE,FALSE,FALSE,FALSE,FALSE,FALSE,FALSE,FALSE,FALSE,FALSE,FALSE,FALSE,,,FALSE,FALSE,FALSE,FALSE,FALSE,FALSE,FALSE,FALSE,FALSE,FALSE,FALSE,FALSE,FALSE,FALSE,FALSE,FALSE,,,,"The Tesla Autopilot is an advanced driver assistance system that enhances safety and convenience behind the wheel, possessing 8 external cameras, a radar, 12 ultrasonic sensors and a powerful onboard computer to sense the vehicle's external environment, internal environment, and control the vehicle's functions. Autopilot possesses two functions, Traffic-Aware Cruise Control, which matches the speed of your car to that of the surrounding traffic and Autosteer, which assists in steering within a clearly marked lane, and uses traffic-aware cruise control",360 Ultrasonic Sonar; Image Recognition Camera; Long Range Radar; traffic patterns,Tesla,Transportation and storage,No,Amateur,High,,TRUE,TRUE,TRUE,FALSE,,Tesla Autopilot,autonomous driving; environmental sensing ,,FALSE,FALSE,FALSE,TRUE,FALSE,FALSE,Camera,,TRUE,TRUE,FALSE,FALSE,,
